,五种庭院别墅风格选型表（含屋前空地照片）,,,,,,,
,,,,,,,,
编号,风格名称,别墅正面+屋前空地照片,屋前空地正面照片（描述）,核心风格关键词,核心庭院元素,建筑搭配要点,适用场景,整体氛围
TY01,现代简约风格,"=DISPIMG(""ID_92F84F45F76F404298982C5AE13371F2"",1)",别墅正面全景，纯白外墙+大面积玻璃幕墙，屋前为平整开阔水泥空地，无任何绿植，仅搭配简单几何线条铺装，整体简洁利落,极简、利落、通透、低饱和,几何造型铺装、极简绿植（如罗汉松、龙柏）、线性水景、灯光亮化、无多余装饰,大面积玻璃幕墙、纯白/深灰外墙、直线条屋顶、开放式露台，无复杂雕花,现代别墅、极简主义业主、小户型庭院、城市近郊别墅,简洁大气、通透高级、整洁有序，凸显现代审美
TY02,新中式风格,"=DISPIMG(""ID_AF80DA42E8ED4FAD899515B637EBA216"",1)",别墅正面为白墙黛瓦、飞檐造型，屋前是平整青石板空地，无绿植，仅点缀2块青石摆件，呼应中式格调，开阔整洁,禅意、雅致、对称、东方美学,枯山水、白砂、青石步石、水景（假山流水）、中式绿植（松、竹、梅、红枫）、月亮门、景墙,白墙黛瓦、飞檐翘角、木质格栅、对称门窗、黛色屋顶，融入中式建筑肌理,中式别墅、偏爱传统文化业主、中大型庭院、江南/中式园区别墅,静谧雅致、古色古香、禅意悠远，兼具实用性与东方韵味
TY03,欧式古典风格,"=DISPIMG(""ID_0C028DD2210A4E3DA762ADA7C58F6F4A"",1)",别墅正面为石材外墙、雕花廊柱，屋前是开阔平整的浅色石材空地，无草坪无绿植，搭配简约欧式石质围栏，凸显庄重感,奢华、庄重、对称、精致雕花,对称花坛、欧式喷泉、雕塑（人物/动物）、大草坪、爬藤玫瑰、雕花栏杆、罗马柱,石材外墙、拱形门窗、雕花廊柱、坡屋顶、浮雕装饰，凸显法式/意式宫廷感,大户型别墅、偏爱奢华质感业主、近郊独栋别墅、西式审美人群,庄重奢华、精致典雅、气势恢宏，自带贵族氛围感
TY04,日式禅意风格,"=DISPIMG(""ID_58A88FA53AD54AB2A3B278C5E5D9250B"",1)",别墅正面为原木外墙、低矮坡屋顶，屋前是平整浅灰色水泥空地，无苔藓、无树木，仅放置1块青石步石，简洁质朴,质朴、静谧、自然、极简禅意,枯山水（白砂铺就）、苔藓地被、青石、竹篱、茶室、步石、日式枫树、菖蒲,原木外墙、低矮坡屋顶、推拉纸门、简约门窗，无多余装饰，贴近自然,小户型庭院、偏爱静谧氛围业主、禅意爱好者、城市别墅（追求闹中取静）,宁静质朴、自然淡雅、禅意十足，适合休闲放松
TY05,田园托斯卡纳风格,"=DISPIMG(""ID_D246ED3BC6E0474FB8BF94A4313EFA0E"",1)",别墅正面为暖黄土黄色外墙、红砖装饰，屋前是开阔平整的碎石空地，无爬藤、无花坛，仅摆放1个简约陶罐，保留乡村质感,温暖、自然、随性、乡村感,爬藤植物（葡萄、蔷薇）、自然花坛、碎石铺装、木质花架、菜园/花园分区、陶罐装饰,暖色调外墙（土黄、米白）、坡屋顶、红砖/文化石、木质门窗，线条柔和,近郊独栋别墅、偏爱乡村氛围业主、中大型庭院、喜欢园艺的人群,温暖治愈、自然随性、充满生活气息，贴近田园诗意
